Human Says,Chat bot says
What time is it?,getTIME
What time  do you have?,getTIME
Got the time?,getTIME
When is it?,getTIME
Do you known what time it is?,getTIME
Do you have the time,getTIME
IDKnull,I dont known.
IDKnull,I'll need to take some time to think on that.
IDKnull,Can you try rephrasing that please?
IDKnull,I'm not sure about that.
IDKnull,Is there a different way you can ask that?
IDKnull,I dont have a response for that.
IDKnull,I will have to give that some thoughts
IDKnull,I don't really known what you are asking.
IDKnull,There are some things I just don't known about yet.
IDKnull,I'm not an expert on that.
IDKnull,I could not tell you
Nothing,What?
Nothing,I think you hit the wrong key...
Nothing,What did you want to ask?
Nothing,Let's talk about something.
Nothing,One more time?
Who are you?,"I am MBC Powered Chat Bot <img src=""https://storage.googleapis.com/ezap-prod/colleges/2100/mar-baselios-christian-college-of-engineering-and-technology-kuttikanam-peermade-logo.jpg"">"
Hello,Hi! Nice to se you.Welcome To MBC CHAT BOT.How Can I Help you?
Hostel facilities in the college,"The College provides residential facilities for boys, girls and the staff members. The College has two separate hostels for boys with a total intake capacity of 850 students and two hostels for girls with 600 total intake capacity. Ergonomically designed rooms provide a feeling of home away from home. MBC has been applauded as the only residential Engineering College in Kerala.                                                                                                                                 Men's Hostel                                                                                                                                                                                                                                                                                                                                                           MBC offers two residential hostels, on a sharing basis, for men, with a total intake capacity of 850 students. The hostels have to their merit a fully-functional 24/7 Wi-Fi access, reading room, fitness centre and recreational area. Hostels in the campus provide the best atmosphere for the academic and personal development of every student. Presence of resident tutors in the hostels is another salient feature that makes stay at MBC a life-time experience.MH I hostel offers well-furnished 69 rooms for men, along with a Prayer hall, TV hall, reading room and a large mess hall.Established in 2005, MH II has 90 spacious rooms for men along with a Prayer hall, recreational room, and an adjacent large mess hall.                                                                                                                                                                                                                                                                                                                                               Ladie's Hostel                                                                                                                                                                                                                                                                                                                MBC offers two residential hostels, on a sharing basis, for women, with a total intake capacity of 600 students. The hostels have to their merit a fully-functional 24/7 Wi-Fi access, reading room, fitness centre and recreational area. Mutual cooperation, sympathy, and love provide the best atmosphere for the academic and personal development of every student and are the characteristics of Ladies’ hostel. Presence of resident tutors in the hostels is another salient feature that makes stay at MBC a life-time experience.LH I hostel offers well-furnished 69 rooms for women, along with a Prayer Hall, TV Hall, Reading Room and a large Mess Hall.Established in 2005, LH II has 90 spacious rooms for women along with a Prayer hall, Recreational Room, and an adjacent large Mess Hall.

"
yes,"Thank you for your interest to join to our college.To join Please fill the google form <a href=""https://docs.google.com/forms/d/e/1FAIpQLSf3maXO4kXjAXrTYZspGI82bIgOOgE2EGxSjIAGOS4kGbWwsw/viewform"">MBC Registration Form</a>"
Under which university the college is,"Kerala Technological University(KTU).<img src=""https://encrypted-tbn0.gstatic.com/images?q=tbn:ANd9GcTJZ03-x5yWcCboU1-KYA78eVAO2GmnAbwZAcf41lDto2C386NYRmB8_eGlZCyvX_bZmiU&usqp=CAU.jpg"">"
Doccuments Required,"Tenth andTwelth Mark Sheet(Original),KEAM Mark Sheet,Contact Certificate from School,Copy of Birth Certificate,Adhar Card(Copy)."
Hai,Hello! How can I help you
Good Afternoon!,Good Afternoon to you!!
Good Morning!,Good Morning To you!!
Thank you for your information,It was my duty to reveal informations about the college with you.Do you Want to join to our College.
hai,Hello! How can I help you
what is the time is,getTIME
What time is it,getTIME
hai,hello
what is the time is,getTime
hai,Hello! How can I help you
Admission Details,"Fees Structure: ***Admission Fees-Rs500***Tution Fees-Rs75000(Management Quota ,Per Year)***Exam Fees-Rs3400***Other Fees=Rs11000(First Year Only),Rs5000(For Rest of the Years)***Tution Fees-Rs50,000(Government Quota)***.The college is offering various scholarships for the B.Tech courses based on the Scholarship Examination. Scholarship Exam registration for 2022 has Started Please click the link for register:<a href=""http://mbccet.in/2022/"">Registration</a>"
College,"It's spectacular landscape is dotted with rich flora and fauna and makes it a dream destination for nature enthusiasts the atmosphere of the campus is of peace and tranquility that is ideal for spiritual and intellectual pursuits the campus is equipped with state-of-the art facilities like spacious lecture halls,high tech laboratories,resourceful libraries on campus boarding facility and a delicious health food cafeteria,the dimensions to the concept of fully residential college are justified with facilities like principal's quarters,staff quarters with seperate hostels for men and women  the amenities are further met with the 24/7 WiFi service, reading room,fitness center and recreational areas.In mbc the hostels can accomodate up to a thousand five hundred students on offer is a range of room along quality services to make living easy comfortable and enjoyable.The fully furnished rooms have WiFi,water coolers other in house facilities include prayer room,house keeping ,medical care,recreation center along with the  mist you can hear the chapel bells ringing through  the wind blow trees on campus is the ST.Mary's Chapel a place to pray and to spend some time with the divine feelings.The Department of physical education is well equipped with the most  modern infrastructure.Here for recreational purpose there are options like indoor badminton court,Volley ball,basket ball,football,cricket and atheletic ground.MBC has a fully functioning multigym for both students and staff opened in the mornings and evenings.Library in MBC provides access for student to a vast database full text journals.The Cafeteria of MBC offers a variety of healthy and hygienic usings it is a perfect place for students to unwind and enjoy snacks. "
Transportation Facilities in the College,"MBC offers transportation facilities to day scholars and faculties for an easy acces to the college.There are seven college buses for to and fro travel from Pampady,Kumil,Kattappana on week days and kottayam,Parumala and Adoor on weekends.The college buses have experienced drivers and supporting staff for a comfortable travel.<img src=""https://www.mbcpeermade.com/UserFiles/MBC/Facilities/Transportation/college_bus.jpg"">"
,
Thank you ,"Please rate the experience with the chat bot<br><a class=""chatSuggest"" onclick=""$(this).hide(); chatSuggest('I am great ')"";>Excellent</a><br><a class=""chatSuggest"" onclick=""$(this).hide(); chatSuggest('Thank you')"";>Good</a><br><a class=""chatSuggest"" onclick=""$(this).hide(); chatSuggest('I am Bad')"";>Bad</a><br>"
I am great,"Thank you so much.<img src=""https://i.pinimg.com/originals/5d/6e/05/5d6e0532769c0cffc7c29ab2ef516653.jpg"">"
Thanks,"Good to hear from you.<img src=""https://www.pngfind.com/pngs/m/233-2330488_blushing-emoji-clipart-good-grief-emoji-sonrisa-png.png"""
I am Bad,"I'm sorry to hear that.Hopefully things will get better soon.<img src=""https://www.cambridge.org/elt/blog/wp-content/uploads/2019/07/Sad-Face-Emoji-480x480.png"""
What day is it?,getDate
Do you know what time it is?,getTime
Do you have the time?,getTime
Eligibility for Btech Admission,"The eligibility for all B.Tech branches admission is:
1)Student should pass +2 or equivalent with Physics, Chemistry & Mathematics as core subjects with minimum 50% marks in aggregate and 50% or above in Mathematics.
2)Student should qualify the All Kerala Engineering Entrance Examination or JEE (Joint Entrance Examination)
3)For NRI Quota, Entrance Examination is not compulsory."
Location to the College,"Location of the College:<a href=""https://www.google.com/maps/place/Mar+Baselios+Christian+College+of+Engineering+and+Technology/@9.5860236,76.9830613,15z/data=!4m5!3m4!1s0x0:0x34518fde62e94372!8m2!3d9.5860236!4d76.9830613"">MBC Location</a>"
About the College,"Mar Baselios Christian College of Engineering & Technology, Kuttikkanam, Peermade, is a self-financing institution for professional Education, affiliated to Dr. APJ Abdul Kalam Technological University (KTU)and approved by All India Council for Technical Education (AICTE), New Delhi. The College is owned and managed by the Malankara Orthodox Syrian Church, which plays a paternal role in the institutions establishment and operations. The institution focuses on offering baccalaureate degree programs in various Engineering streams. MBC began its journey in 2001 and is one of the biggest residential colleges in kerala.MBCwitnesses a steady academic growth in its path the college excels and baccalaureate degree program invarious engineering streams.It's sprawling education complexes are spread across 77 acres of beautiful natural landscapes and is located amid lush green tea plantation meadows and reserve forest in the most nature rich area in kerala kuttukkanam Idukki.It's spectacular landscape is dotted with rich flora and fauna and makes it a dream destination for nature enthusiasts the atmosphere of the campus is of peace and tranquility that is ideal for spiritual and intellectual pursuits the campus is equipped with state-of-the art facilities like spacious lecture halls,high tech laboratories,resourceful libraries on campus.  Our aim is to provide our students with the best possible facilities and the right training. We emphasize on teaching excellence and wholesome learning experience and strive towards making MBC a premier educational institution. With the various batches of students already passed out with flying colours, the College is well on to fulfil its long term objective of being a centre of excellence as far as quality education and student life is concerned. The College has continued its advancement as a centre for learning and public service coupled with excellent university exam results, high profile campus placements and cultural activities. The full time B.Tech enrolment of about 1600 students, the emphasis on teaching excellence, and the increasingly high proportion of students and teaching faculty residing in the campus highlight the personal collegiate atmosphere that makes the MBC Campus quite unique.                                                      ---------------------------------------------------------------------------------------------------------------------------------------------------------------------------------------------------------------------------------------------------------------------------------------------------------------------                                                                                                                                                                                              President of the College: H.H. Baselios Marthoma Mathews III                                                                                                                                                           <img src=""https://www.mbcpeermade.com/UserFiles/MBC/About_Us/Management/Preseident_1.jpg"">                                                                                                                                                                ---------------------------------------------------------------------------------------------------------------------------------------------------------------------------------------------------------------------------------------------------------------------------------------------------------------------                                                                                                                                                                                                                                                                                                                                               Director of the College:Mr Prince Varghese                                                                                                                                                                                               <img src=""https://www.mbcpeermade.com/UserFiles/MBC/About_Us/Administration/director_03.jpg"">                                                                                                                                                                                                     ---------------------------------------------------------------------------------------------------------------------------------------------------------------------------------------------------------------------------------------------------------------------------------------------------------------------Principal of the College:Dr Jayaraj Kochupillai                                                                                                                                                                                            <img src=""https://www.mbcpeermade.com/UserFiles/MBC/About_Us/Administration/principal.jpg"">                                                                                                                                                                                                                              ---------------------------------------------------------------------------------------------------------------------------------------------------------------------------------------------------------------------------------------------------------------------------------------------------------------------                      Student Advisor of the College:Fr.Eldho Saju                                                                                                                                                                                                 <img src=""https://www.mbcpeermade.com/UserFiles/MBC/About_Us/Administration/stuadvisor.jpg"">                                                                                                                                                                                                                          ---------------------------------------------------------------------------------------------------------------------------------------------------------------------------------------------------------------------------------------------------------------------------------------------------------------------Dean-Student Affairs:Dr.Nirmala Joseph                                                                                                                                                                                    <img src=""https://www.mbcpeermade.com/UserFiles/MBC/About_Us/Administration/dean_student_affairs.jpg"">                                                                                                                                                                                                  ---------------------------------------------------------------------------------------------------------------------------------------------------------------------------------------------------------------------------------------------------------------------------------------------------------------------Former Directors and Principals:<a href=""https://www.mbcpeermade.com/Former-Directors-and-Principals"">Former-Directors-and-Principals</a>"
Scholarship Details,"The college is offering various scholarships for the B.Tech courses based on the Scholarship Examination. Scholarship Exam registration for 2022 ha Started Please click the link for register:<a href=""http://mbccet.in/2022/"">Registration</a>"
Overview of the College,MBC help you to be an engineer and it engineer.Mbc the name synomynous with Quality education which is affiliated to KTU university and approved by AICET New Delhi.MBC began the journey in 2001 and is one of the residential College in Kerala.
no,"Think it more ,if you are interested  ,For more details Contact:+91- 7559933571,+91- 9072200344"
Placement in the college,"The Placement season runs through the course of the year starting from the month of August to June. Pre-placement talks and trainings are conducted in this regard. Job opportunities, Date of interviews, Selection of candidates, Job offer letters are announced thorough the Training and Placement Cell. Being one of the pioneer Self Financing Engineering Campuses in the State, our alumnae have set excellent standards in the corporate world through their technical contributions. This legacy is deemed to continue as the Cell facilitates an extra year’s unvarying placement assistance and career guidance to the students even after the completion of their regular Engineering course in the college. We have Central Computing Facility to host any number of online test for placements.Major Recruters are:<img src=""https://www.mbcpeermade.com/userFiles/recruiters/2da27831be60407ab397d737bb0d6321.jpg "">---------------------------------------------------------------------------------------------------------------------<img src=""https://www.mbcpeermade.com/userFiles/recruiters/ab7095b0f01841dfa2ca524350e3524f.jpg"">---------------------------------------------------------------------------------------------------------------------------------------------------------------------------------<img src=""https://www.mbcpeermade.com/userFiles/recruiters/a9fbbc442df2402b9b8451d1d54a6202.jpg "">-------------------------------------------------------------------------------------------------------------------------------------------------------------------------------<img src=""https://www.mbcpeermade.com/userFiles/recruiters/4449da5aa5fe4e7595613dd25310ef07.jpg"">-------------------------------------------------------------------------------------------------------------------------------------------------------------------------------<img src=""https://www.mbcpeermade.com/userFiles/recruiters/02609b6e606e4a4b94b0fc31f92dbfd3.jpg"">---------------------------------------------------------------------------------------------------------------------------------------------------------------------------------<img src=""https://www.mbcpeermade.com/userFiles/recruiters/f3096132dd224f38b746bd1c1e6783b8.jpg"">--------------------------------------------------------------------------------------------------------------------------------------------------------------------------------<img src=""https://www.mbcpeermade.com/userFiles/recruiters/353725579098415494e4861b46c8f092.jpg"">--------------------------------------------------------------------------------------------------------------------------------------------------------------------------------<img src=""https://www.mbcpeermade.com/userFiles/recruiters/31e6682492c1458c9b2cf1afa3ee1ab5.jpg "">"
courses Offered,"There are mainly Five Streams in BTech,ie Computer Science and Engineering(60 Seats),Electrical and Electronics Engineering(60 Seats),Electronics and Communication Engineering(60 Seats),Civil Engineering(60 Seats),Mechanical Engineering(60 Seats)..Which course do you prefer?<br><a class=""chatSuggest"" onclick=""$(this).hide(); chatSuggest('CSE Department')"";>CSE</a><br><a class=""chatSuggest"" onclick=""$(this).hide(); chatSuggest('EEE Department')"";>EEE</a><br><a class=""chatSuggest"" onclick=""$(this).hide(); chatSuggest('EC Department')"";>EC</a><br><a class=""chatSuggest"" onclick=""$(this).hide(); chatSuggest('ME Department')"";>ME </a><br><a class=""chatSuggest"" onclick=""$(this).hide(); chatSuggest('CE Department')"";>CE </a><br>.Do you want to join to our college. Please fill the google form: <a href=""https://docs.google.com/forms/d/e/1FAIpQLSf3maXO4kXjAXrTYZspGI82bIgOOgE2EGxSjIAGOS4kGbWwsw/viewform"">MBC Registration</a>"
